Fecha,Hora,Descripción,Enlace
16 · 10 · 2024,11:29,"Reducción de pistas en Isidora Goyenechea al norte, esquina Av. Andrés Bello, debido a trabajos relacionados con construcción de nueva estación de Metro en el lugar. Situación genera tránsito lento. Considere alternativa.",https://www.transporteinforma.cl/estado_de_transito/reduccion-de-pistas-en-isidora-goyenechea-al-norte-esquina-av-andres-bello-debido-a-trabajos-relacionados-con-construccion-de-nueva-estacion-de-metro-en-el-lugar-situacion-genera-transito-lento-c/
16 · 10 · 2024,11:29,Ciclovía ubicada en la ribera del río Mapocho se encuentra CERRADA entre Puente Loreto y Huelén. Opta por ciclovía de Mapocho42k.,https://www.transporteinforma.cl/estado_de_transito/accesos-ciclo-parque-en-ribera-de-rio-mapocho-estan-cerrados-hasta-nuevo-aviso/
16 · 10 · 2024,11:28,"Santa Magdalena tiene sólo una pista disponible al norte, entre Av. Providencia y Av. Andrés Bello, debido a trabajos de pavimentos.",https://www.transporteinforma.cl/estado_de_transito/santa-magdalena-tiene-solo-una-pista-disponible-al-norte-entre-av-providencia-y-av-andres-bello-debido-a-trabajos-de-pavimentos/
16 · 10 · 2024,11:28,"Cierre total de calzada de calle Camino Rinconada, entre calle Sigfrido y Av. Maipú, en la comuna de Maipú, para realizar montaje de grúa, los días 02 de octubre de 2024, 07 de octubre de 2024, 11 de octubre de 2024, 17 de octubre de 2024 y el 25 de octubre de 2024.",https://www.transporteinforma.cl/estado_de_transito/cierre-total-de-calzada-de-calle-camino-rinconada-entre-calle-sigfrido-y-av-maipu-en-la-comuna-de-maipu-para-realizar-montaje-de-grua-los-dias-02-de-octubre-de-2024-07-de-octubre-de-2024-11-de/
16 · 10 · 2024,11:28,"Calle Guardia Vieja tiene tránsito suspendido entre Av. Nueva Providencia y Av. Providencia, debido a trabajos de nivelación de calzada.",https://www.transporteinforma.cl/estado_de_transito/calle-guardia-vieja-tiene-transito-suspendido-entre-av-nueva-providencia-y-av-providencia-debido-a-trabajos-de-nivelacion-de-calzada/
16 · 10 · 2024,11:27,Sólo una pista habilitada en Tajamar al norte desde Av. Vitacura (frente a Costanera Center) debido a trabajos por construcción de estación de teleférico. Situación genera congestión desde Av. Apoquindo. Prefiera alternativa.,https://www.transporteinforma.cl/estado_de_transito/solo-una-pista-habilitada-en-tajamar-al-norte-desde-av-vitacura-frente-a-costanera-center-debido-a-trabajos-por-construccion-de-estacion-de-teleferico-situacion-genera-congestion-desde-av-apoquin/
16 · 10 · 2024,09:41,Complejo Fronterizo Los Libertadores Tránsito de Paso Los Libertadores desde/hacia Argentina es HABILITADO desde las 13:00 horas de hoy miércoles 09/10. Conduzca atento a condición de la vía.,https://www.transporteinforma.cl/estado_de_transito/paso-los-libertadores/
15 · 10 · 2024,07:33,Restricción de la pista derecha en Carlos Antúnez entre Marchant Pereira y Av. Ricardo Lyon entre las 09:30 y 17:30 horas por trabajos en la vía. Trabajos se extenderán hacia Av. Tobalaba con fecha de término en diciembre.,https://www.transporteinforma.cl/estado_de_transito/restriccion-de-la-pista-derecha-en-carlos-antunez-entre-marchant-pereira-y-av-ricardo-lyon-entre-las-0930-y-1730-horas-por-trabajos-en-la-via-trabajos-se-extenderan-hacia-av-tobalaba-con-fecha-de/
